[
  {
    "legacy_id": "3",
    "kind": "social_item",
    "source_file": "config/main.json",
    "source_layer": "stored",
    "content_version": "004ba829043dfb00d78888a764bd7e13a37db9c5c05195cd910ac3d570678bb3",
    "id": 3,
    "workers": "Oil QA Supervisor, Chemical",
    "worker_cost": 1,
    "description": ""
  },
  {
    "legacy_id": "9",
    "kind": "social_item",
    "source_file": "config/main.json",
    "source_layer": "stored",
    "content_version": "004ba829043dfb00d78888a764bd7e13a37db9c5c05195cd910ac3d570678bb3",
    "id": 9,
    "workers": "Miner, Miner Assistant, Explosives Vigilant",
    "worker_cost": 2,
    "description": ""
  },
  {
    "legacy_id": "12",
    "kind": "social_item",
    "source_file": "config/main.json",
    "source_layer": "stored",
    "content_version": "004ba829043dfb00d78888a764bd7e13a37db9c5c05195cd910ac3d570678bb3",
    "id": 12,
    "workers": "Forge maintenance, Logistics supervisor, Factory Boss, Steel Provider, Steel Supervisor",
    "worker_cost": 2,
    "description": ""
  },
  {
    "legacy_id": "16",
    "kind": "social_item",
    "source_file": "config/main.json",
    "source_layer": "stored",
    "content_version": "004ba829043dfb00d78888a764bd7e13a37db9c5c05195cd910ac3d570678bb3",
    "id": 16,
    "workers": "Forge maintenance, Logistics Supervisor, Factory Boss, Steel Provider, Steel Supervisor",
    "worker_cost": 2,
    "description": ""
  },
  {
    "legacy_id": "28",
    "kind": "social_item",
    "source_file": "config/main.json",
    "source_layer": "stored",
    "content_version": "004ba829043dfb00d78888a764bd7e13a37db9c5c05195cd910ac3d570678bb3",
    "id": 28,
    "workers": "Doctor, Doctor Assistant",
    "worker_cost": 2,
    "description": ""
  },
  {
    "legacy_id": "37",
    "kind": "social_item",
    "source_file": "config/main.json",
    "source_layer": "stored",
    "content_version": "004ba829043dfb00d78888a764bd7e13a37db9c5c05195cd910ac3d570678bb3",
    "id": 37,
    "workers": "Physics expert, GUI supervisor, Landings trainer, Commander Pilot, Captain Pilot, Sergeant Pilot, Damage Expert",
    "worker_cost": 3,
    "description": ""
  },
  {
    "legacy_id": "44",
    "kind": "social_item",
    "source_file": "config/main.json",
    "source_layer": "stored",
    "content_version": "004ba829043dfb00d78888a764bd7e13a37db9c5c05195cd910ac3d570678bb3",
    "id": 44,
    "workers": "Physics expert, Ballistics engineer, Soldier trainer, Explosives specialist",
    "worker_cost": 2,
    "description": ""
  },
  {
    "legacy_id": "54",
    "kind": "social_item",
    "source_file": "config/main.json",
    "source_layer": "stored",
    "content_version": "004ba829043dfb00d78888a764bd7e13a37db9c5c05195cd910ac3d570678bb3",
    "id": 54,
    "workers": "Technical Supervisor, Aerodynamics Expert, Pilot",
    "worker_cost": 2,
    "description": ""
  },
  {
    "legacy_id": "61",
    "kind": "social_item",
    "source_file": "config/main.json",
    "source_layer": "stored",
    "content_version": "004ba829043dfb00d78888a764bd7e13a37db9c5c05195cd910ac3d570678bb3",
    "id": 61,
    "workers": "Ally I, Ally II, Ally III, Ally IV, Ally V, Ally VI, Ally VII, Ally VIII, Ally IX",
    "worker_cost": 2,
    "description": ""
  },
  {
    "legacy_id": "64",
    "kind": "social_item",
    "source_file": "config/main.json",
    "source_layer": "stored",
    "content_version": "004ba829043dfb00d78888a764bd7e13a37db9c5c05195cd910ac3d570678bb3",
    "id": 64,
    "workers": "Mechanic,Mechanic",
    "worker_cost": 2,
    "description": ""
  },
  {
    "legacy_id": "74",
    "kind": "social_item",
    "source_file": "config/main.json",
    "source_layer": "stored",
    "content_version": "004ba829043dfb00d78888a764bd7e13a37db9c5c05195cd910ac3d570678bb3",
    "id": 74,
    "workers": "Friend,Friend,Friend,Friend,Friend,Friend,Friend,Friend",
    "worker_cost": 2,
    "description": ""
  },
  {
    "legacy_id": "75",
    "kind": "social_item",
    "source_file": "config/main.json",
    "source_layer": "stored",
    "content_version": "004ba829043dfb00d78888a764bd7e13a37db9c5c05195cd910ac3d570678bb3",
    "id": 75,
    "workers": "Spy Veteran, Spy Trainer",
    "worker_cost": 2,
    "description": ""
  },
  {
    "legacy_id": "140",
    "kind": "social_item",
    "source_file": "config/main.json",
    "source_layer": "stored",
    "content_version": "004ba829043dfb00d78888a764bd7e13a37db9c5c05195cd910ac3d570678bb3",
    "id": 140,
    "workers": "New recruit,New recruit,New recruit",
    "worker_cost": 3,
    "description": ""
  },
  {
    "legacy_id": "3003",
    "kind": "social_item",
    "source_file": "config/main.json",
    "source_layer": "stored",
    "content_version": "004ba829043dfb00d78888a764bd7e13a37db9c5c05195cd910ac3d570678bb3",
    "id": 3003,
    "workers": "Oil QA Supervisor, Chemical",
    "worker_cost": 1,
    "description": ""
  },
  {
    "legacy_id": "3009",
    "kind": "social_item",
    "source_file": "config/main.json",
    "source_layer": "stored",
    "content_version": "004ba829043dfb00d78888a764bd7e13a37db9c5c05195cd910ac3d570678bb3",
    "id": 3009,
    "workers": "Miner, Miner Assistant, Explosives Vigilant",
    "worker_cost": 2,
    "description": ""
  },
  {
    "legacy_id": "3012",
    "kind": "social_item",
    "source_file": "config/main.json",
    "source_layer": "stored",
    "content_version": "004ba829043dfb00d78888a764bd7e13a37db9c5c05195cd910ac3d570678bb3",
    "id": 3012,
    "workers": "Forge maintenance, Logistics supervisor, Factory Boss, Steel Provider, Steel Supervisor",
    "worker_cost": 2,
    "description": ""
  },
  {
    "legacy_id": "3016",
    "kind": "social_item",
    "source_file": "config/main.json",
    "source_layer": "stored",
    "content_version": "004ba829043dfb00d78888a764bd7e13a37db9c5c05195cd910ac3d570678bb3",
    "id": 3016,
    "workers": "Forge maintenance, Logistics Supervisor, Factory Boss, Steel Provider, Steel Supervisor",
    "worker_cost": 2,
    "description": ""
  },
  {
    "legacy_id": "3028",
    "kind": "social_item",
    "source_file": "config/main.json",
    "source_layer": "stored",
    "content_version": "004ba829043dfb00d78888a764bd7e13a37db9c5c05195cd910ac3d570678bb3",
    "id": 3028,
    "workers": "Doctor, Doctor Assistant",
    "worker_cost": 2,
    "description": ""
  },
  {
    "legacy_id": "3037",
    "kind": "social_item",
    "source_file": "config/main.json",
    "source_layer": "stored",
    "content_version": "004ba829043dfb00d78888a764bd7e13a37db9c5c05195cd910ac3d570678bb3",
    "id": 3037,
    "workers": "Physics expert, GUI supervisor, Landings trainer, Commander Pilot, Captain Pilot, Sergeant Pilot, Damage Expert",
    "worker_cost": 3,
    "description": ""
  },
  {
    "legacy_id": "3044",
    "kind": "social_item",
    "source_file": "config/main.json",
    "source_layer": "stored",
    "content_version": "004ba829043dfb00d78888a764bd7e13a37db9c5c05195cd910ac3d570678bb3",
    "id": 3044,
    "workers": "Physics expert, Ballistics engineer, Soldier trainer, Explosives specialist",
    "worker_cost": 2,
    "description": ""
  },
  {
    "legacy_id": "3054",
    "kind": "social_item",
    "source_file": "config/main.json",
    "source_layer": "stored",
    "content_version": "004ba829043dfb00d78888a764bd7e13a37db9c5c05195cd910ac3d570678bb3",
    "id": 3054,
    "workers": "Technical Supervisor, Aerodynamics Expert, Pilot",
    "worker_cost": 2,
    "description": ""
  },
  {
    "legacy_id": "3061",
    "kind": "social_item",
    "source_file": "config/main.json",
    "source_layer": "stored",
    "content_version": "004ba829043dfb00d78888a764bd7e13a37db9c5c05195cd910ac3d570678bb3",
    "id": 3061,
    "workers": "Ally I, Ally II, Ally III, Ally IV, Ally V, Ally VI, Ally VII, Ally VIII, Ally IX",
    "worker_cost": 2,
    "description": ""
  },
  {
    "legacy_id": "3064",
    "kind": "social_item",
    "source_file": "config/main.json",
    "source_layer": "stored",
    "content_version": "004ba829043dfb00d78888a764bd7e13a37db9c5c05195cd910ac3d570678bb3",
    "id": 3064,
    "workers": "Mechanic, Mechanic Assistant",
    "worker_cost": 2,
    "description": ""
  },
  {
    "legacy_id": "3074",
    "kind": "social_item",
    "source_file": "config/main.json",
    "source_layer": "stored",
    "content_version": "004ba829043dfb00d78888a764bd7e13a37db9c5c05195cd910ac3d570678bb3",
    "id": 3074,
    "workers": "Ally I, Ally II, Ally III, Ally IV, Ally V, Ally VI, Ally VII, Ally VIII, Ally IX",
    "worker_cost": 2,
    "description": ""
  },
  {
    "legacy_id": "3075",
    "kind": "social_item",
    "source_file": "config/main.json",
    "source_layer": "stored",
    "content_version": "004ba829043dfb00d78888a764bd7e13a37db9c5c05195cd910ac3d570678bb3",
    "id": 3075,
    "workers": "Spy Veteran, Spy Trainer",
    "worker_cost": 2,
    "description": ""
  },
  {
    "legacy_id": "3140",
    "kind": "social_item",
    "source_file": "config/main.json",
    "source_layer": "stored",
    "content_version": "004ba829043dfb00d78888a764bd7e13a37db9c5c05195cd910ac3d570678bb3",
    "id": 3140,
    "workers": "New recruit,New recruit,New recruit",
    "worker_cost": 3,
    "description": ""
  }
]
